job_title,company_name,job_posted,job_description,job_link
Site Reliability Engineer,ibex,,"ibex. is looking for a Site Reliability Engineer, to join our team. This role offers the opportunity to work with cutting-edge technologies, drive automation, and enhance infrastructure resilience. If you are a proactive problem-solver passionate about optimizing systems, we would love to hear from you!ResponsibilitiesContinuous Integration & Deployment:Design, implement, and enhance CI/CD pipelines for Kubernetes-based platforms.Build and maintain Docker container images, managing all associated dependencies.Environment Setup & MaintenanceConfigure, automate, and maintain environments across diverse infrastructures, including on-premises Kubernetes clusters, AWS EKS, VMware, and containerized environments.Focus on process automation to increase efficiency and consistency.Cluster ManagementDeploy and manage large-scale Kubernetes clusters, MySQL clusters, storage solutions (e.g., OpenEBS), ELK stacks, and Redis.Ensure high availability and resilience of infrastructure.Automation & Configuration ManagementLeverage tools like Ansible and Puppet to automate environment setup and simplify configuration management.Application ModernizationCollaborate with development teams to transition legacy monolithic applications to microservices architectures on both on-premises and public cloud platforms, enhancing scalability and maintainability.Dashboard & Integration DevelopmentCreate dashboards and integrate components to improve visibility into infrastructure and application performance.Operational AutomationUtilize APIs, CLI tools, and custom scripting to automate repetitive operational tasks, improving efficiency and reducing manual effort.QualificationsOperating Systems:Proficiency in Unix-based environments, including RedHat and Ubuntu.Build & CI ToolsExperience with build systems (e.g., Dockerfiles, Make) and CI/CD tools like GitLab CI/CD and Jenkins.Virtualization & ContainerizationHands-on experience with VMware, Docker containers, and Kubernetes orchestration.ScriptingProficiency in scripting languages such as Bash, Python, and PowerShell.Platform CLI ToolsFamiliarity with CLI tools for Veeam Backup, VMware, AWS, Azure, and Netscaler load balancers.API IntegrationAbility to interact with REST APIs for data retrieval and posting, including implementing authentication and authorization mechanisms.Container Orchestration & ManagementExpertise with on-prem Kubernetes (including AWS EKS) and Docker Compose.Configuration Management & Infrastructure As Code (IaC)Skilled in tools like Ansible, Puppet, and Terraform.Monitoring & Logging ToolsExperience with Grafana, Prometheus, ELK stack, and SolarWinds for monitoring and logging.Cloud PlatformsFamiliarity with AWS, Azure, and Google Cloud Platform (GCP).Source ControlProficient in Git for version control and team collaboration.The candidate should have 7 to 8 years of relevant experience.",https://pk.linkedin.com/jobs/view/site-reliability-engineer-at-ibex-4272730085?trk=public_jobs_topcard-title
Python Engineer,Unstuck Labs,4 days ago,"Location: Gulberg Greens, Islamabad OR DHA, Karachi Job Type: Full-time, On-siteUnstuck labs is seeking a talented and experienced Python Engineer tojoin our dynamic team. The ideal candidate will be responsible for designing, developing, and maintaining scalable server side systems, APIs, and LLM integrations; ensuring seamless integration between the front-end and back-end components.Key ResponsibilitiesDevelop and maintain scalable applications using Python with a variety of frameworks like FastAPI, Django, etc.Write and maintain efficient, reusable, and reliable code.Collaborate with other developers and managers in the team.Work with databases (SQL and NoSQL).Develop RESTful APIs and integrate third-party services as needed.Integrate LLMs, NLP engines with Python services.Ensure application performance, scalability, and security.Participate in code reviews, testing, and debugging.Stay updated with emerging technologies and apply them into operations and activities.Requirements3+ years of professional experience as a Software Engineer while working with Python.Proficient understanding of databases (both SQL and NoSQL).Experience with API design and development (RESTful services).Familiarity with cloud services on AWS is a plus.Good understanding of Git version control.Strong problem-solving skills and ability to work independently.Proficient hands on expertise of using best coding practices, principles and design patterns is highly desirable.Knowledge of DevOps practices and CI/CD pipelines is a plus.Experience with writing tests and testing frameworks.",https://pk.linkedin.com/jobs/view/python-engineer-at-unstuck-labs-4271615611?trk=public_jobs_topcard-title
AI Agent Forward Deployment Engineer,Beam AI,1 week ago,"About BeamBeam is a tech start-up revolutionising business operations with AI. Our AI Agents empower organisations by automating repetitive tasks, boosting productivity in seconds. With seamless integration into business applications, our agents provide support where teams need it most. Our mission? To transform business practices, increase efficiency, improve competitiveness, and scale operations globally.To learn more about us, please visit our website at https://www.beam.ai/About The RoleWe're looking for an AI Agent Forward Deployment Engineer to join Beam and help us deliver AI-powered solutions! In this role, you'll be at the core of our automation platform, designing and refining AI-driven workflows through prompt engineering and hands-on problem-solving. You'll work closely with the team to understand business needs and help build agents that drive real impact.This is a great opportunity for someone curious about AI, eager to learn, and excited to gain hands-on experience in a fast-paced startup environment. We're especially looking for someone with a technical foundation and programming skills, who is comfortable learning new tools and translating process requirements into automated workflows. This is a great opportunity for someone who has a strong drive to build, test, and improve real-world AI solutions.ResponsibilitiesYour work will focus on agent building and prompt design, while collaborating with team members to support project delivery. The key responsibilities include:Build AI agents using our no-code platform, focusing on prompt creation and automation workflowsPresent demonstrations of your AI agents, showing how they address business needs and improve efficiencyCollaborate with the internal team to scope use cases, break down processes, and translate them into agent logicSupport integration efforts by understanding basic API connections and working with our technical teamParticipate in internal testing, feedback cycles, and training sessions to build skills in agent creation and no-code toolsContribute to improving workflows by sharing learnings from experimentation and demo creationRequirementsBachelor's in Computer Science, Software Engineering, AI/ML or a related technical fieldPrior experience (e.g., internships, academic projects, or part-time roles) in technical roles such as Solutions or deployment Engineering, or Implementation SupportInterest in prompt engineering and willingness to learn hands-onProgramming knowledge, ideally in Python or Node.jsAbility to break down business processes and think analytically about automationBasic understanding of how APIs work and how systems connectStrong communication and documentation skillsInterest in AI technologies and a willingness to learn in a hands-on, fast-paced environmentNice to have:Familiarity with no-code tools such as Zapier, Make, Relevance AI, Lindy, or similarBackground in AI/ML or experience applying AI to business workflowsExperience in fast-paced or startup environmentsBenefitsWhy Beam?At Beam, we foster a culture of ownership and growth, giving you the freedom to take charge of your work and make a meaningful impact on the future of AI. As part of a highly collaborative, fast-paced startup, you'll have the opportunity to work at the forefront of AI innovation, designing and building solutions that address real-world business challenges.We offer more than just a job. Here, you'll find: Ownership and autonomy: You'll have the opportunity to own the full lifecycle of projects, from conception to execution, and see your work directly impact businesses worldwide Personal and professional growth: We encourage continuous learning and innovation. Whether you're advancing in your technical expertise, growing your leadership skills, or shaping the next generation of AI solutions, your growth is our priority Being at the cutting edge: You'll be working with the latest AI technologies, driving innovation in generative AI and natural language processing Competitive benefits and stock options: We offer a competitive salary, stock options, and comprehensive benefits to ensure you're not only rewarded today but also invested in the future of the company.  Collaborative Culture: You'll work alongside brilliant minds in an agile, collaborative, and supportive startup environment, where your ideas can truly make a differenceIf you are passionate about leveraging AI to drive innovation and thrive in a collaborative, fast-paced environment, we'd love to hear from you! Join us in shaping the future of AI-powered solutions!",https://pk.linkedin.com/jobs/view/ai-agent-forward-deployment-engineer-at-beam-ai-4267074789?trk=public_jobs_topcard-title
Shopify Developer,Pro Coffee Gear,2 weeks ago,"Job Position: Shopify DeveloperCompany: Pro Coffee GearLocation: Remote (Anywhere)Full-TimeAbout UsPro Coffee Gear is a thriving e-commerce company located on our scenic 20-acre ranch in Austin, Texas. We specialize in providing top-tier espresso machines and related parts to coffee enthusiasts worldwide. Our dedication to excellence extends beyond our products; we're committed to building a talented team that shares our passion for coffee and exceptional customer service.Job OverviewWe are seeking a skilled Shopify Developer to join our growing team and help enhance our e-commerce platform. The ideal candidate will have extensive experience with Shopify development, theme customization, and app integration to create seamless shopping experiences for our customers.Key ResponsibilitiesDevelop and maintain custom Shopify themes and templates that align with our brand identityBuild custom functionalities and features using Shopify Liquid, HTML, CSS, and JavaScriptIntegrate third-party applications and APIs to enhance store functionalityOptimize website performance for speed, mobile responsiveness, and SEOCollaborate with design and marketing teams to implement new features and improve user experienceTroubleshoot and resolve technical issues across the Shopify platformManage product catalogs, inventory systems, and checkout processesImplement tracking and analytics tools to monitor site performanceEnsure website security and compliance with e-commerce best practicesStay updated with Shopify platform updates and new featuresRequired Qualifications3+ years of experience in Shopify development and customizationProficiency in Shopify Liquid templating languageStrong knowledge of HTML5, CSS3, JavaScript, and responsive design principlesExperience with Shopify APIs (REST Admin API, Storefront API, GraphQL)Familiarity with version control systems (Git)Understanding of e-commerce best practices and conversion optimizationExperience with Shopify app development and third-party integrationsKnowledge of web performance optimization techniquesDesired SkillsExperience with Shopify Plus for enterprise-level solutionsFamiliarity with modern JavaScript frameworks (React, Vue.js)Knowledge of SEO best practices and implementationExperience with payment gateway integrationsUnderstanding of inventory management and fulfillment systemsShopify Partner certification or similar credentialsExperience in the coffee/specialty retail industryTechnical RequirementsPortfolio demonstrating custom Shopify theme developmentExperience with Shopify CLI and development toolsKnowledge of cross-browser compatibility and testingUnderstanding of accessibility standards (WCAG)Experience with A/B testing and conversion rate optimizationBenefitsFlexible schedule with opportunities for growthWork remotely from the comfort of your own homeJoin a dynamic and passionate international team in the exciting world of coffeeCompetitive salary commensurate with experienceProfessional development opportunities and continued learningHow to ApplyIf you're ready to join our team and help build exceptional e-commerce experiences, please submit your resume in English along with your portfolio showcasing your Shopify development work (resumes in other languages will be immediately disqualified). We look forward to hearing from you!Pro Coffee Gear is an equal-opportunity employer. We celebrate diversity and are committed to creating an inclusive environment for all employees.",https://pk.linkedin.com/jobs/view/shopify-developer-at-pro-coffee-gear-4265092210?trk=public_jobs_topcard-title
QA Automation Engineer,Idenfo,2 days ago,"Job Summary:The QA Automation Engineer, will play a crucial role in ensuring the quality, reliability, and performance of our software products. Working closely with the development team, you will be responsible for testing and identifying any issues or bugs that may affect the user experience. Your attention to detail and ability to think critically will be essential in providing valuable feedback and suggestions for improving the software.Responsibilities:Collaborate with the development team to understand software requirements, specifications, and user stories.Design and execute test plans, test cases, and test scripts to ensure comprehensive test coverage.Perform functional, regression, integration, and system testing to identify software defects and ensure adherence to quality standards.Conduct manual and automated testing to validate software functionality, usability, and performance.Document and report bugs, issues, and enhancement requests using bug tracking systems.Work closely with developers to isolate and reproduce defects, and provide detailed information to assist in the debugging process.Collaborate with cross-functional teams to ensure timely resolution of identified issues and drive product improvements.Contribute to the continuous improvement of QA processes, tools, and methodologies.Stay up-to-date with industry best practices and emerging trends in software testing and quality assurance.Requirements:Bachelor's degree in Computer Science or related field (BSCS preferred).1-2 years of professional experience in only software quality assurance field.Strong understanding of software development lifecycle and QA methodologies.Knowledge of software testing principles, techniques, and tools.Experience with automated testing tools (e.g., Cypress, Selenium)Familiarity with bug tracking systems (e.g., Jira).Hands-on experience with API testing (e.g Postman).Proficiency in at least one programming language (e.g., Java, Python) is a plus.Excellent analytical and problem-solving skills.A passion for quality and a desire to deliver exceptional software products.Very good written and verbal communication skillsMust be fluent in English.Join our dynamic team. Apply now with your resume and cover letter outlining your relevant experience.",https://pk.linkedin.com/jobs/view/qa-automation-engineer-at-idenfo-4271545558?trk=public_jobs_topcard-title
Data Engineer,NorthBay - Pakistan,1 week ago,"Job Title: Data Engineer Location: Karachi, Lahore , Islamabad (Hybrid)Experience: 5+ YearsJob Type: Full-TimeJob OverviewWe are looking for a highly skilled and experienced Data Engineer with a strong foundation in Big Data, distributed computing, and cloud-based data solutions. This role demands a strong understanding of end-to-end Data pipelines, data modeling, and advanced data engineering practices across diverse data sources and environments. You will play a pivotal role in building, deploying, and optimizing data infrastructure and pipelines in a scalable cloud-based architecture.Key ResponsibilitiesDesign, develop, and maintain large-scale Data pipelines using modern big data technologies and cloud-native tools.Build scalable and efficient distributed data processing systems using Hadoop, Spark, Hive, and Kafka.Work extensively with cloud platforms (preferably AWS) and services like EMR, Glue, Lambda, Athena, S3.Design and implement data integration solutions pulling from multiple sources into a centralized data warehouse or data lake.Develop pipelines using DBT (Data Build Tool) and manage workflows with Apache Airflow or Step Functions.Write clean, maintainable, and efficient code using Python, PySpark, or Scala for data transformation and processing.Build and manage relational and columnar data stores such as PostgreSQL, MySQL, Redshift, Snowflake, HBase, ClickHouse.Implement CI/CD pipelines using Docker, Jenkins, and other DevOps tools.Collaborate with data scientists, analysts, and other engineering teams to deploy data models into production.Drive data quality, integrity, and consistency across systems.Participate in Agile/Scrum ceremonies and utilize JIRA for task management.Provide mentorship and technical guidance to junior team members.Contribute to continuous improvement by making recommendations to enhance data engineering processes and architecture.Required Skills & Experience5+ years of hands-on experience as a Data Engineer Deep knowledge of Big Data technologies – Hadoop, Spark, Hive, Kafka.Expertise in Python, PySpark and/or Scala.Proficient with data modeling, SQL scripting, and working with large-scale datasets.Experience with distributed storage like HDFS and cloud storage (e.g., AWS S3).Hands-on with data orchestration tools like Apache Airflow or StepFunction.Experience working in AWS environments with services such as EMR, Glue, Lambda, Athena.Familiarity with data warehousing concepts and experience with tools like Redshift, Snowflake (preferred).Exposure to tools like Informatica, AbInitio, Apache Iceberg is a plus.Knowledge of Docker, Jenkins, and other CI/CD tools.Strong problem-solving skills, initiative, and a continuous learning mindset.Preferred QualificationsBachelor’s or Master’s degree in Computer Science, Data Engineering, or related field.Experience with open table formats such as Apache Iceberg.Hands-on with AbInitio (GDE, Collect > IT) or Informatica tools.Knowledge of Agile methodology, working experience in JIRA.Soft SkillsSelf-driven, proactive, and a strong team player.Excellent communication and interpersonal skills.Passion for data and technology innovation.Ability to work independently and manage multiple priorities in a fast-paced environment.",https://pk.linkedin.com/jobs/view/data-engineer-at-northbay-pakistan-4268686457?trk=public_jobs_topcard-title
AI Engineer,eZhire,2 days ago,"Job title: AI EngineerLocation: Shahrah-e-Faisal, KarachiKey ResponsibilitiesBuild and optimize LLM-based chatbots and agents using frameworks like LangGraph or LangChainDevelop and document FastAPI/Flask-based microservices to serve AI modelsDesign and maintain RAG pipelines using vector databases (FAISS, Chroma)Deploy and track models using MLflow, with proper versioning and metric loggingContribute to CI/CD pipelines and containerization using DockerSet up experiment tracking, hyperparameter tuning, and structured model evaluationPreprocess datasets, build embeddings, and optimize memory usage in inference flowsRequired SkillsMust haves;2-4 years Experience with Python, with hands-on experience building APIs (FastAPI or Flask)2+ years Experience with LangChain / LangGraph / Crew ai for chatbot/agent development2+ years Experience with vector stores (FAISS, Chroma, Pinecone or any other vdb) and RAG architecturesFamiliar with transformers and LLMs (OpenAI, LLaMA, Mistral, etc.)Ability to build, test, and document clean, maintainable codeNice to haves;Understanding of MLOps practices, including MLflow for tracking and deploymentsExperience with Docker, Git, and cloud-based or local deployment workflowsIdeal CandidateBachelors or Masters degree in Computer Science/ Software engineering/ Data science/ AI or any related field2-4 years of professional experience in AI / Agentic AIInterested candidates are requested to share there resumes at career@ezhire.life and mention position in the subject line.",https://pk.linkedin.com/jobs/view/ai-engineer-at-ezhire-4275360501?trk=public_jobs_topcard-title
Senior AI Engineer I,Careem,3 days ago,"About the CompanyCareem is building the Everything App for the greater Middle East, making it easier than ever to move around, order food and groceries, manage payments, and more. Careem is led by a powerful purpose to simplify and improve the lives of people and build an awesome organisation that inspires. Since 2012, Careem has created earnings for over 2.5 million Captains, simplified the lives of over 70 million customers, and built a platform for the region’s best talent to thrive and for entrepreneurs to scale their businesses. Careem operates in over 70 cities across 10 countries, from Morocco to Pakistan.About The TeamThe Careem Data Science team’s mission is to drive competitive value from data at scale through building AI models to optimize user experiences, decision making, operational efficiencies, and lead the region’s AI ecosystem. As one of the leaders in this team, you will be at the forefront of fulfilling this mission. You will be working with and leading the top data science talent of the region, leveraging AI to solve the region’s day-to-day problems, through state-of-the-art machine learning, optimization, deep learning, and RL models, that are deployed on top of our own in-house AI platform, serving users in real-time.What you'll doBuild a long-term vision on how we can rethink our customer acquisition and engagement strategies, leveraging data in our decision making.Drive exploratory analysis to understand the ecosystem, user behavior, identify new levers to help move metrics and build models of user behaviors for analysis and product enhancements.Shape and influence data/ML models and instrumentation to optimize the product experience and generate insights on new areas of opportunity and new products.Provide product leadership by sharing data-based recommendations to communicate state of business, root cause of change in metrics and experimentation results influencing product and business decisionsImplement scalable machine learning algorithms that will be used in production on big data.Embark on exploratory data analysis projects to achieve a better understanding of phenomena as well as to discover untapped areas of growth and optimization. Answer complex analytic questions from big data sets to help Careem shape its products and services in a better way.Help define and track the appropriate key metrics for specific projects. Design and run randomized controlled experiments, analyze the resulting data,a and communicate results with other teams.You will always challenge the status quo and continually investigate new data processing technologies and seek to ensure that we follow the industry best practices.What you'll needExperience in data mining, predictive modeling, time series analysis, machine learning, Big Data methodologies, transformation, and cleaning of both structured and unstructured data.Advanced degree in a quantitative discipline such as Physics, Statistics, Mathematics, Engineering or Computer Science.Strong problem-solving and coding skills.Solid knowledge of and experience with marketplace problems in ride hailing and delivery services. Solid knowledge of AB testing, classic ML, and DLSolid understanding of recommendations, learning to rank, uplift modeling,g and matching problems. Fluency in English along with excellent oral and written communication skills.Proficiency and demonstrated experience in: Python, SQL, Spark, Hive.Demonstrated experience with database technologies (e.g. Hadoop, BigQuery, Amazon EMR, Hive, Oracle, SAP, DB2, Teradata, MS SQL Server, MySQL).Demonstrated experience with business intelligence and visualization tools (Tableau, MicroStrategy, ChartIO, Qlik) along with geospatial data processing skills is a plus.Knowledge of Agile methodologies.What We’ll Provide YouWe offer colleagues the opportunity to drive impact in the region while they learn and grow. As a full time Careem colleague, you will be able to:Work and learn from great minds by joining a community of inspiring colleagues.Put your passion to work in a purposeful organisation dedicated to creating impact in a region with a lot of untapped potential.Explore new opportunities to learn and grow every day.Work 4 days a week in office & 1 day from home, and remotely from any country in the world for 30 days a year with unlimited vacation days per year. (If you are in an individual contributor role in tech, you will have 2 office days a week and 3 to work from home.)Access to healthcare benefits and fitness reimbursements for health activities including gym, health club, and training classes.",https://pk.linkedin.com/jobs/view/senior-ai-engineer-i-at-careem-4271311320?trk=public_jobs_topcard-title
