job_title,company_name,job_posted,job_description,job_link
Senior Backend Developer - RUST,NorthBay - Pakistan,1 week ago,"We are looking for a talented and experienced Senior Backend Developer with a strong command of Rust and its ecosystem to join our dynamic development team. The ideal candidate will possess a deep understanding of the entire web development process, from design to deployment, and experience across multiple programming languages such as Java, Nodejs, PHP, and Python, and a good understanding of frontend and mobile technologies such as React and React Native. The successful candidate will play a crucial role in our development team, demonstrating strong verbal and written communication skills in English for effective collaboration with both technical and non-technical stakeholders.RequirementsAt-least 5 years of professional software development experience with at least 1 - 2 years of hands on experience in Rust.Strong proficiency in one or more of the followingJava (Spring Boot)Node.js / Express .Net / .Net coreSolid understanding of systems-level concepts, async programming, memory safety, and performance optimizationProven experience developing and consuming RESTful APIs.Familiarity with front-end and mobile languages (e.g. React, React Native, Tailwind CSS)Experience building:Microservices or RESTful APIWebAssembly appsTech stack & Tools:Rust (Actix, Axum, Rocket, Tokio)SQLx, SeaORM, Serde, Clap, ReqwestExperience with Git, Contanerization and CICD pipelinesExperience with AWS cloud platform and its servicesStrong verbal and written communication skills in English for both technical and non-technical audiences.In-depth understanding of the entire web development process (design, development, and deployment)Familiar with SQL/NoSQL database (e.g. PostgreSQL, MySQL, MongoDB) and experience with database optimization Excellent problem-solving skills and ability to work in a fast-paced environment.MS / BSc degree in Computer Science or relevant field Attention to detail, curiosity, perceptiveness, and patience.Independence, accountability for assigned tasks, and effective time management.Experience working in Agile or Scrum environments.Responsibilities:Lead the design and development of complex features and systems, ensuring scalability, security, and maintainability.Build and optimize RESTful APIs and microservices to support frontend and mobile applications.Ensure high code quality through best practices such as CI/CD, code reviews, and secure coding standards.Refactor and modernize legacy systems while introducing new tools, frameworks, and techniques.Collaborate with cross-functional teams including product, design, frontend, and mobile developers.Identify, assess, and mitigate technical risks early in the project lifecycle.Embrace a consulting mindset by translating technical requirements into business solutions and proposing scalable, efficient approaches.Mentor junior developers and contribute to internal process and workflow improvements.Continuously explore and adopt new technologies to improve product scalability and performance.Assist in the development and improvement of team processes and workflows to enhance productivity and code quality.",https://pk.linkedin.com/jobs/view/senior-backend-developer-rust-at-northbay-pakistan-4268174978?trk=public_jobs_topcard-title
Full Stack Engineer,ibex,2 weeks ago,"Who We’re Looking For:Are you passionate about creating robust and scalable software solutions?Join us as a Full Stack Developer and play a key role in building impactful applications. We’re looking for someone with a strong technical background, problem-solving mindset, and collaborative attitude to help shape our innovative projects.What You’ll Do: • Design, develop, and implement scalable software applications using C# and .NET Core. • Build and optimize Web APIs with a focus on best practices. • Work with JavaScript, jQuery, and other front-end technologies to deliver seamless user experiences. • Write clean, efficient, and maintainable code with a focus on performance and scalability. • Collaborate with developers, product managers, and stakeholders to deliver new features and enhancements. • Troubleshoot, debug and upgrade the software to ensure optimal functionality. • Lead by example, providing technical guidance and mentorship to the team.What You’ll Bring: • Education: Bachelor’s Degree in Computer Science or a related field. • Experience: 2 years of hands-on experience in software development, including front-end and back-end work. • Technical Skills: • Strong expertise in C#, .NET Core, MVC, and Microservices architecture. • Proficiency in JavaScript, jQuery, and other front-end frameworks. • Knowledge of database management and integration. • Soft Skills: • Excellent verbal and written communication skills. • Strong analytical, problem-solving, and organizational abilities. • A collaborative team player with a proactive attitude.Why Join Us? • Competitive salary and comprehensive benefits. • Performance bonuses based on your contributions and team achievements. • The opportunity to work on industry-leading projects.Location: This is a full-time, onsite role based in Karachi.",https://pk.linkedin.com/jobs/view/full-stack-engineer-at-ibex-4261883923?trk=public_jobs_topcard-title
Full Stack Developer,"I.Q. Technologies, Inc",1 week ago,"Job descriptionAt I.Q. Technologies, you have an excellent opportunity to excel in your career within a thriving organization. We are looking for a qualified, experienced, and motivated individual to become part of IQ's team today! Requirements:- Senior Full Stack Developer with 2-3 years of Industry Experience.-Experience with Python, Golang, Django, Java, Java Script, HTML, CSS etc.-Experience with SQL, MySQL, NoSQL, MongoDB, MS-SQL etc.-Experience with a front-end UI framework, using Angular, React.-Experience with GitLabPreferred but not required:-Mobile Application development-E-Commerce website development-Containers, Kubernetes etc.Education:Bachelor's in Computer Science or related field or equivalent work experience.Job Type: Fulltime (part-time optional)CVs are required during the initial application process. Only candidates that fulfill the necessary requirements will be considered/ contacted. NO DIRECT CALLS IN REGARD TO THIS POSTION",https://pk.linkedin.com/jobs/view/full-stack-developer-at-i-q-technologies-inc-4267994540?trk=public_jobs_topcard-title
Golang Backend Engineer,Unstuck Labs,4 days ago,"Location: Gulberg Greens, Islamabad OR DHA, Karachi | Job Type: Full-time, On-siteUnstuck labs is seeking a talented and experienced Golang Backend Engineer tojoin our dynamic team. The ideal candidate will be responsible for designing, developing, and maintaining scalable server side systems and APIs, ensuring seamless integration between the front-end and back-end components.Key ResponsibilitiesDevelop and maintain scalable server-side applications using Go language with a variety of frameworks like Gin, FastHttp, etc.Write and maintain efficient, reusable, and reliable code.Collaborate with other developers and managers in the team.Work with databases (SQL and NoSQL).Develop RESTful APIs and integrate third-party services as needed.Ensure application performance, scalability, and security.Participate in code reviews, testing, and debugging.Stay updated with emerging technologies and apply them into operations and activities.Requirements3+ years of professional experience as a Software Engineer while working with the go language.Proficient understanding of databases (both SQL and NoSQL).Experience with API design and development (RESTful services).Familiarity with cloud services on AWS is a plus.Good understanding of Git version control.Strong problem-solving skills and ability to work independently.Proficient hands on expertise of using best coding practices, principles and design patterns is highly desirable.Knowledge of DevOps practices and CI/CD pipelines is a plus.Experience with writing tests and testing frameworks.",https://pk.linkedin.com/jobs/view/golang-backend-engineer-at-unstuck-labs-4271609977?trk=public_jobs_topcard-title
Senior Backend Engineer (Django),Dubizzle Labs,3 days ago,"As a Senior Software Engineer (Backend) you will liaises with the other backend and frontend engineers within your product stream, the QA team, the design team and your Tech Team Leads. As a senior member of the team, you will be responsible for advancing our development stack and ensuring scale as we grow to millions of monthly active users across many countries.In This Role, You WillHit the ground running - Gather up-to-date and in-depth understanding of the dubizzle code base and technologies stack within weeks;Lead planning sessions around new product features, deliver detailed roll-out/roll-back strategies for releases.Research and apply industry trends as part of your daily work;Create unit tests in accordance with our established standards to cover assigned work;Write and maintain exemplary code following dubizzle’s programming practices;Actively contribute in post-release maintenance issues;Develop elegant solutions for complex problems;Pioneer reliability and efficiency of our current code base, platforms and/or core systems;Impact on the direction and scope of dubizzle’s technical vision within your stream;Work in a mentoring capacity within a peer-programming environment and provide guidance on tasks, irrespective of complexity or scale;Code review all major pull requests, defining programming standards and providing constructive feedback.Design and delivery of multiple REST based APIs and previous exposure to Service Oriented Architecture;Capacity to push back requirements when incomplete;Handle the entire software development life cycle, end to end;Lead product planning meetings and architect solutions within your stream;Liaises with the other back end engineers within your product stream, the QA team, design team and your Tech Team Lead;Liaise with other tech teams to share innovations from your stream.Requirements4+ years of professional back-end software engineering experience; Python preferred;Experience with Cloud hosted infrastructure and Technologies; AWS preferred;Prior experience with Kubernetes & Docker will earn you brownie points;Experience working on high-traffic and large-scale web products is preferred;Experience with web infrastructure, SOA, distributed systems, performance analysis, search infrastructure;Been on at least one “death march” and know exactly why some things are to be avoided;Strong understanding of design patterns including asynchronous programming, queuing, logging, security and persistence;Mastery of different caching layers and strategies including memcached;Good understanding of build process management and continuous integration;Mastery of testing methodologies (unit tests, component tests, integration tests, etc.);Excellent communication & interpersonal skills; This is an absolute must, we have heated debates around complicated subjects and you will be expected to lead conversations around them.",https://pk.linkedin.com/jobs/view/senior-backend-engineer-django-at-dubizzle-labs-4161102445?trk=public_jobs_topcard-title
Kotlin Developer,IRVINEi,4 weeks ago,"Job Summary:We are seeking an experienced Android Kotlin Developer to join our team, responsible for developing and maintaining our mobile application. The ideal candidate will have expertise in implementing instant messaging, video calling, and live streaming features using various protocols and technologies. The candidate will collaborate with cross-functional teams, ensure high-performance and efficiency, and stay up-to-date with emerging technologies.Responsibilities:- Design and implement robust features for instant messaging and presence functionalities using XMPP.- Develop and integrate video calling features using WebRTC.- Implement live streaming capabilities using RTSP, ensuring high performance and efficiency.- Collaborate with cross-functional teams to define, design, and ship new features.- Troubleshoot and fix bugs, improving application performance and scalability.- Continuously explore, evaluate, and implement new technologies to maximize development efficiency.- Work with third-party libraries and APIs to enhance application functionality.- Stay up-to-date with the latest mobile landscape, architectures, trends, and emerging technologies.- Participate in the full mobile development life cycle, from design to deployment.- Write clean, testable, and maintainable code.- Ensure code quality, following best practices and coding standards.Requirements:- Strong proficiency in the Kotlin programming language.- Experience with Android app development.- Knowledge of XMPP, WebRTC, and RTSP protocols.- Familiarity with third-party libraries and APIs.- Understanding of mobile development life cycle.- Excellent problem-solving skills and strong debugging skills.- Strong communication and collaboration skills.",https://pk.linkedin.com/jobs/view/kotlin-developer-at-irvinei-4258435362?trk=public_jobs_topcard-title
Asterisk Voice Developer,H3 Technologies,2 weeks ago,"Location: PECHS Block-6, KarachiJob Type: Full-TimeJob Description:We are looking for an experienced Asterisk Voice Developer with strong hands-on expertise in:Asterisk setup, configuration, and troubleshootingAPI integrations with telephony systemsDatabase connectivity (MySQL/PostgreSQL) for call logic & dynamic routingAgent-to-Agent Dialling and custom call flowsDeveloping and maintaining voice applications and SIP-based solutionsKnowledge of AMI (Asterisk Manager Interface) and AGI scripting is a plusRequirements:2+ years of experience with Asterisk/FreePBX or similar platformsStrong understanding of VoIP protocols (SIP, RTP)Proficient in PHP, Python, or Bash scriptingExperience integrating APIs with telecom platformsAbility to work independently and manage production-level voice systemsApply Now:Please send your CV to: usama@h3techs.com#voicedevlopers #robocall #voicejobs #asterisk",https://pk.linkedin.com/jobs/view/asterisk-voice-developer-at-h3-technologies-4263591319?trk=public_jobs_topcard-title
Abbyy FlexiCapture Consultant / Developer,Archive Services-Document Scanning and Digitization,4 days ago,"Job Description:We are seeking an experienced Abbyy FlexiCapture Consultant / Developer to join our team. The ideal candidate will have hands-on expertise in implementing, configuring, and optimizing Abbyy FlexiCapture solutions to streamline document processing workflows.Responsibilities:Design, develop, and implement document processing workflows using Abbyy FlexiCaptureCreate and train FlexiLayouts and document definitions for structured and unstructured documentsIntegrate Abbyy FlexiCapture with third-party systems via API (REST/SOAP)Configure and maintain document classification, data extraction, and export rulesTroubleshoot and resolve issues related to capture accuracy, performance, and deploymentProvide technical support and user training as neededRequirements:Proven experience with Abbyy FlexiCapture 12 or higherStrong knowledge of document layout development and OCR/ICR technologiesStrong problem-solving and communication skillsAbility to work independently and deliver high-quality results",https://pk.linkedin.com/jobs/view/abbyy-flexicapture-consultant-developer-at-archive-services-document-scanning-and-digitization-4268597798?trk=public_jobs_topcard-title
Alteryx Developer,Datamatics Technologies,2 days ago,"Job Summary: We are looking for a highly skilled Alteryx Developer to join our data analytics team in Riyadh, Saudi Arabia. The ideal candidate will have 4+ years of experience working with Alteryx Designer and Server, and a solid understanding of data integration, automation, and transformation. A secondary focus will be on dashboard development and data visualization using tools like Power BI and Tableau, with at least 2+ years of experience. You will play a critical role in building scalable data workflows, automating manual processes, and enabling selfservice analytics across business functions. The role demands both strong technical proficiency and a problemsolving mindset. Key Responsibilities:  Design, develop, and deploy eƯicient, scalable workflows using Alteryx Designer for data preparation, blending, cleansing, and transformation.  Manage and schedule workflows using Alteryx Server, ensuring optimal performance and proper resource utilization.  Integrate data from various sources including SQL databases, Excel, APIs, flat files, and ERP systems into unified data pipelines.  Collaborate with business stakeholders and analysts to translate requirements into automated data solutions.  Build and support dashboards and interactive reports using Power BI or Tableau to present insights in a meaningful, user-friendly format.  Monitor job performance, troubleshoot failures, and implement best practices for automation and error handling.  Support data governance initiatives by ensuring accuracy, consistency, and integrity of datasets.  Work closely with data engineers, analysts, and IT teams to ensure data availability, scalability, and reliability.  Provide documentation, user training, and knowledge transfer sessions as needed. Required Skills & Qualifications:  Bachelor’s degree in computer science, Information Systems, Data Analytics, or a related field.  4+ years of hands-on experience with Alteryx Designer and Alteryx Server in a production environment.  Proficiency in data transformation, parsing, and automation using Alteryx tools and macros.  2+ years of experience in developing dashboards and visual analytics using Power BI and/or Tableau.  SQL skills with experience working on relational databases like SQL Server, Oracle, or similar platforms.  Good understanding of ETL concepts, data modeling, and analytics lifecycle.  Strong analytical and problem-solving skills with attention to detail.  Ability to manage multiple tasks, meet deadlines, and work in a fast-paced environment.  Excellent communication skills, both verbal and written. Preferred Qualifications:  Alteryx Certification (e.g., Alteryx Designer Core or Advanced).  Experience working in audit analytics, risk, finance, or internal control environments.  Exposure to API integrations.  Knowledge of Python or R is a plus for extending Alteryx capabilities.  Familiarity with data governance and data privacy frameworks.",https://pk.linkedin.com/jobs/view/alteryx-developer-at-datamatics-technologies-4269298912?trk=public_jobs_topcard-title
Senior Backend Developer - RUST,NorthBay Solutions,1 week ago,"We are looking for a talented and experienced Senior Backend Developer with a strong command of Rust and its ecosystem to join our dynamic development team. The ideal candidate will possess a deep understanding of the entire web development process, from design to deployment, and experience across multiple programming languages such as Java, Nodejs, PHP, and Python, and a good understanding of frontend and mobile technologies such as React and React Native. The successful candidate will play a crucial role in our development team, demonstrating strong verbal and written communication skills in English for effective collaboration with both technical and non-technical stakeholders.Requirements:At-least 5 years of professional software development experience with at least 1 - 2 years of hands on experience in Rust.Strong proficiency in one or more of the followingJava (Spring Boot)Node.js / Express .Net / .Net coreSolid understanding of systems-level concepts, async programming, memory safety, and performance optimizationProven experience developing and consuming RESTful APIs.Familiarity with front-end and mobile languages (e.g. React, React Native, Tailwind CSS)Experience building:Microservices or RESTful APIWebAssembly appsTech stack & Tools:Rust (Actix, Axum, Rocket, Tokio)SQLx, SeaORM, Serde, Clap, ReqwestExperience with Git, Contanerization and CICD pipelinesExperience with AWS cloud platform and its servicesStrong verbal and written communication skills in English for both technical and non-technical audiences.In-depth understanding of the entire web development process (design, development, and deployment)Familiar with SQL/NoSQL database (e.g. PostgreSQL, MySQL, MongoDB) and experience with database optimization Excellent problem-solving skills and ability to work in a fast-paced environment.MS / BSc degree in Computer Science or relevant field Attention to detail, curiosity, perceptiveness, and patience.Independence, accountability for assigned tasks, and effective time management.Experience working in Agile or Scrum environments.Responsibilities:Lead the design and development of complex features and systems, ensuring scalability, security, and maintainability.Build and optimize RESTful APIs and microservices to support frontend and mobile applications.Ensure high code quality through best practices such as CI/CD, code reviews, and secure coding standards.Refactor and modernize legacy systems while introducing new tools, frameworks, and techniques.Collaborate with cross-functional teams including product, design, frontend, and mobile developers.Identify, assess, and mitigate technical risks early in the project lifecycle.Embrace a consulting mindset by translating technical requirements into business solutions and proposing scalable, efficient approaches.Mentor junior developers and contribute to internal process and workflow improvements.Continuously explore and adopt new technologies to improve product scalability and performance.Assist in the development and improvement of team processes and workflows to enhance productivity and code quality.",https://pk.linkedin.com/jobs/view/senior-backend-developer-rust-at-northbay-solutions-4265992942?trk=public_jobs_topcard-title
Senior Backend Engineer (Python/JAVA),dubizzle,2 days ago,"As a Mid/Senior Backend Engineer you will liaises with the other backend and frontend engineers within your product stream, the QA team, the design team and your Tech Team Leads. As a senior member of the team, you will be responsible for advancing our development stack and ensuring scale as we grow to millions of monthly active users across many countries.In this role, you will: Hit the ground running - Gather up-to-date and in-depth understanding of the dubizzle code base and technologies stack within weeks; Lead planning sessions around new product features, deliver detailed roll-out/roll-back strategies for releases Research and apply industry trends as part of your daily work; Create unit tests in accordance with our established standards to cover assigned work; Write and maintain exemplary code following dubizzle's programming practices; Actively contribute in post-release maintenance issues; Develop elegant solutions for complex problems; Pioneer reliability and efficiency of our current code base, platforms and/or core systems; Impact on the direction and scope of dubizzle's technical vision within your stream; Work in a mentoring capacity within a peer-programming environment and provide guidance on tasks, irrespective of complexity or scale; Code review all major pull requests, defining programming standards and providing constructive feedback Design and delivery of multiple REST based APIs and previous exposure to Service Oriented Architecture; Capacity to push back requirements when incomplete; Handle the entire software development life cycle, end to end; Lead product planning meetings and architect solutions within your stream; Liaises with the other back end engineers within your product stream, the QA team, design team and your Tech Team Lead; Liaise with other tech teams to share innovations from your stream Requirements 5+ years of professional back-end software engineering experience; Python preferred; Experience with Cloud hosted infrastructure and Technologies; AWS preferred; Prior experience with Kubernetes & Docker will earn you brownie points; Experience working on high-traffic and large-scale web products is preferred; Experience with web infrastructure, SOA, distributed systems, performance analysis, search infrastructure; Been on at least one ""death march"" and know exactly why some things are to be avoided; Strong understanding of design patterns including asynchronous programming, queuing, logging, security and persistence; Mastery of different caching layers and strategies including memcached; Good understanding of build process management and continuous integration; Mastery of testing methodologies (unit tests, component tests, integration tests, etc.); Excellent communication & interpersonal skills; This is an absolute must, we have heated debates around complicated subjects and you will be expected to lead conversations around them",https://pk.linkedin.com/jobs/view/senior-backend-engineer-python-java-at-dubizzle-4185213634?trk=public_jobs_topcard-title
